"Categoria","Subcategoria","Contenido_Tecnico","Etiquetas","Fuente"
"Ciclismo_Ruta","Potencia_Aerobica","Regla del Sweet Spot (Punto Dulce): El trabajo prolongado al 88-93% del FTP genera la mayor adaptación de TSS por encima del tiempo de recuperación biológico requerido. Ideal para las pretemporadas.","sweet_spot,ftp,adaptacion,tss","Manual Alpha v1.2"
"Ciclismo_Ruta","Biomecanica","Mejora Aerodinámica Pasiva: Posición de 'Puppy Paws' ha sido prohibida en carreras oficiales. Alternativa: Manos en las manetas dobladas horizontalmente cruzando antebrazos, logrando 80% de la ventaja aerodinámica legalmente.","aerodinamica,postura,uci","Manual Alpha v1.2"
"Ciclismo_Ruta","Tactica_Peloton","Drafting efectivo: Situarse a 30-50 cm de la rueda trasera del ciclista delantero corta el coeficiente de resistencia al viento (Drag) entre un 30% a 40%. Ahorro tremendo de Vatios de potencia. Pulsaciones pueden caer 10-20 lpm.","drafting,drag,vatios,estrategia","Manual Alpha v1.2"
"Ciclismo_Ruta","Cadencia_Eficiente","La cadencia aeróbica ideal en rutas largas sin desnivel oscila entre 85-95 rpm. Entrenar la alta cadencia permite que el trabajo recaiga más sobre el sistema aeróbico central (cardiovascular) salvando las reservas locales de glucógeno muscular.","cadencia,rpm,cardiovascular","Manual Alpha v1.2"
"Fisiologia","Recuperacion_Activa","Sesión de recuperación post-etapa (Active Recovery): 30-45 minutos al 40-50% del FTP. Ayuda drásticamente al aclaramiento de la acumulación de lactato intracelular sin causar microroturas adicionales. Obligatorio tras carrera de 4h.","recuperacion,Z1,lactato","Manual Alpha v1.2"
